<?xml version="1.0" encoding="utf-8" standalone="no"?>
<SZK_orarend xmlns:xsi="http://www.w3.org/2001/XMLSchema-instance" xsi:noNamespaceSchemaLocation="Y4O4X0_orarend1.xsd">
        
    <ora id="O0" tipus="elmelet">
                
        <targy>Elektrotechnika és elektronika (Ea)</targy>
                
        <idopont>
                        
            <nap>Hétfő</nap>
                        
            <tol>8:00</tol>
                        
            <ig>10:00</ig>
                    
        </idopont>
                
        <helyszin>A2/III. Előadó</helyszin>
                
        <oktato>Szabó Nórbert</oktato>
                
        <szak>Árnyékolás technikus</szak>
            
    </ora>
        
    <ora id="O1" tipus="elmelet">
                
        <targy>Webtechnológia I (WI)</targy>
                
        <idopont>
                        
            <nap>Hétfő</nap>
                        
            <tol>10:00</tol>
                        
            <ig>12:00</ig>
                    
        </idopont>
                
        <helyszin>A2/I. Előadó</helyszin>
                
        <oktato>Agárdi Anita</oktato>
                
        <szak>Árnyékolás technikus</szak>
            
    </ora>
        
    <ora id="O3" tipus="gyakorlat">
                
        <targy>Angol szaknyelv (Av)</targy>
                
        <idopont>
                        
            <nap>Hétfő</nap>
                        
            <tol>12:00</tol>
                        
            <ig>14:00</ig>
                    
        </idopont>
                
        <helyszin>XXXVII</helyszin>
                
        <oktato>Dorkó Dóra</oktato>
                
        <szak>Árnyékolás technikus</szak>
            
    </ora>
        
    <ora id="O4" tipus="gyakorlat">
                
        <targy>Webtechnológia I (WI)</targy>
                
        <idopont>
                        
            <nap>Hétfő</nap>
                        
            <tol>14:00</tol>
                        
            <ig>16:00</ig>
                    
        </idopont>
                
        <helyszin>Inf/101</helyszin>
                
        <oktato>Agárdi Anita</oktato>
                
        <szak>Árnyékolás technikus</szak>
            
    </ora>
        
    <ora id="O5" tipus="elmelet">
                
        <targy>Mobilprogramozás alapjai (Mi)</targy>
                
        <idopont>
                        
            <nap>Hétfő</nap>
                        
            <tol>16:00</tol>
                        
            <ig>18:00</ig>
                    
        </idopont>
                
        <helyszin>Inf/101</helyszin>
                
        <oktato>Agárdi Anita</oktato>
                
        <szak>Árnyékolás technikus</szak>
            
    </ora>
        
    <ora id="O6" tipus="gyakorlat">
                
        <targy>Mobilprogramozás alapjai (Mi)</targy>
                
        <idopont>
                        
            <nap>Hétfő</nap>
                        
            <tol>18:00</tol>
                        
            <ig>20:00</ig>
                    
        </idopont>
                
        <helyszin>Inf/101</helyszin>
                
        <oktato>Agárdi Anita</oktato>
                
        <szak>Árnyékolás technikus</szak>
            
    </ora>
        
    <ora id="O7" tipus="elmelet">
                
        <targy>Windows rendszergazda (Wa)</targy>
                
        <idopont>
                        
            <nap>Kedd</nap>
                        
            <tol>8:00</tol>
                        
            <ig>10:00</ig>
                    
        </idopont>
                
        <helyszin>Inf/103</helyszin>
                
        <oktato>Wagner György</oktato>
                
        <szak>Árnyékolás technikus</szak>
            
    </ora>
        
    <ora id="O8" tipus="gyakorlat">
                
        <targy>Webes adatkezelő környezetek (Wk)</targy>
                
        <idopont>
                        
            <nap>Kedd</nap>
                        
            <tol>12:00</tol>
                        
            <ig>14:00</ig>
                    
        </idopont>
                
        <helyszin>Inf/101</helyszin>
                
        <oktato>Dr Bednarik László</oktato>
                
        <szak>Árnyékolás technikus</szak>
            
    </ora>
         
    <ora id="O9" tipus="gyakorlat">
                
        <targy>Elektrotechnika és elektronika (Ea)</targy>
                
        <idopont>
                        
            <nap>Szerda</nap>
                        
            <tol>8:00</tol>
                        
            <ig>10:00</ig>
                    
        </idopont>
                
        <helyszin>A1/310</helyszin>
                
        <oktato>Szabó Norbert</oktato>
                
        <szak>Árnyékolás technikus</szak>
            
    </ora>
        
    <ora id="O10" tipus="gyakorlat">
                
        <targy>Mesterséges intelinegcia (Ma)</targy>
                
        <idopont>
                        
            <nap>Szerda</nap>
                        
            <tol>10:00</tol>
                        
            <ig>12:00</ig>
                    
        </idopont>
                
        <helyszin>A1/218</helyszin>
                
        <oktato>Fazekas Levente</oktato>
                
        <szak>Árnyékolás technikus</szak>
            
    </ora>
        
    <ora id="O11" tipus="gyakorlat">
                
        <targy>Windows rendszergazda (Wa)</targy>
                
        <idopont>
                        
            <nap>Szerda</nap>
                        
            <tol>12:00</tol>
                        
            <ig>14:00</ig>
                    
        </idopont>
                
        <helyszin>Inf/101</helyszin>
                
        <oktato>Wagner György</oktato>
                
        <szak>Árnyékolás technikus</szak>
            
    </ora>
        
    <ora id="O12" tipus="elmelet">
                
        <targy>Webes adatkezelő környezetek (Wk)</targy>
                
        <idopont>
                        
            <nap>Szerda</nap>
                        
            <tol>14:00</tol>
                        
            <ig>16:00</ig>
                    
        </idopont>
                
        <helyszin>Inf/102</helyszin>
                
        <oktato>Dr Kovács László</oktato>
                
        <szak>Árnyékolás technikus</szak>
            
    </ora>
         
    <ora id="O13" tipus="elmelet">
                
        <targy>Mesterséges intelinegcia (Ma)</targy>
                
        <idopont>
                        
            <nap>Szerda</nap>
                        
            <tol>16:00</tol>
                        
            <ig>18:00</ig>
                    
        </idopont>
                
        <helyszin>A1/XXXII előadó</helyszin>
                
        <oktato>Kunné Dr. Tamás Judit</oktato>
                
        <szak>Árnyékolás technikus</szak>
            
    </ora>
    
</SZK_orarend>
